id,name,why,how,bonus_points,published
1,Attend a family reunion.,Whether your family fits in a minivan or can field a complete tackle-football team; there's something to be said for a reunion: a day or two dedicated to the pursuit of family connectedness; among relatives ordinarily separated by distance and by generations. Families are important support networks; emotionally and logistically; and it's just nice to stay close to them. ,Big families will often turn these into giant productions; complete with catering and organized events; but even a small family can find an excuse to come together. Make a home movie (your grandkids will laugh hysterically at it one day); have a celebratory dinner; or take a day-trip to a location important in your family history -- you might also find it effective to ditch the excuses and just spent a day in one another's company. Awesome! ,25,1
2,Attend live theatre.,There is nothing quite like live theatre. Whether you're watching a raucous musical; a cerebral drama; or an absurd experimental performance; the experience of watching live actors helps you appreciate what you're seeing on a level you just can't get with movies or television -- good theatre connects you emotionally to its characters and viscerally to its story. Maybe that's why the form has survived for literally thousands of years. ,In a big place like New York; London or L.A. this is easy; but there are opportunities to see theatre just about anywhere. You can be conventional and visit a touring Broadway show; although it's cooler to support local community theatre. If there's a college near you; there will almost certainly be tons of interesting - and often free - theatre happening there. ,10,1
3,Be grateful.,We live in an amazing world; filled with amazing people -- but amid all the trouble and heartache we face; we often miss the joys and blessings of everyday life. Change that: being grateful for even the smallest things can upend our emotional states and add a note of optimism to our days. ,"Whether it's through a religious tradition; a mindfulness meditation; or simply by saying ""thank you"" (to your family and friends; the everyday people you meet; or no one in particular); make an effort to be grateful for the good things in your life. Don't forget about the basics: food; water; shelter; and good company are all opportunities for gratitude. ",2,1
4,Be true to yourself.,Everybody's under pressure to be someone they're not. But unless you're an undercover agent; we're pretty sure that you don't have to be. So why let other people decide how you live? ,"Well; let's not take this to extremes. Maybe your true self really enjoys bunny-style pajamas; you still probably shouldn't wear them to work. BUT; there's always room in your life for you to let your true colors show. Choose to spend your time on things that you care about; not just whatever everyone else is doing -- in other words; don't stand in long lines just because there's a long line. Share your opinions; respectfully but forthrightly; and make sure your voice is heard. Pick a ""guilty pleasure"" song you really like; turn it up; and dance like nobody's looking. Or: ignore our instructions; and be yourself the way YOU want to! ",2,1
5,Bring your lunch.,Paying for lunch -- at work; at school; wherever -- is what financial experts call; to use the technical term; a big stupid waste of money; especially if you're looking to eat something more nutritious than a $1.99 cheeseburger. Don't be forced to choose between your wallet and your arteries: bring a healthy lunch with you instead. ,"There's something to be said for our old friend the sandwich -- but to prevent brown-bag boredom; get fresh and get creative. Even if you don't have access to a refrigerator; there's plenty you can do. Fruit or raw veggies should be a standby in every lunch (hint: the more colorful; the better); and complement them with a protein-rich; low-fat choice like poultry or broth-based soup. Don't go frozen unless you have to; processed foods like that are more expensive; less nutrient-dense; and even if they're labeled ""diet"" or ""low-fat"" often contain way more sodium and calories than you need. ",2,1
6,Build muscle strength.,"When you hear ""weight training;"" you might get a mental image of Saturday Night Live's Hans and Franz: ""We're going to PUMP. YOU UP."" Here's a better way to think about it: weight or strength training is exercise that targets muscle development to help you burn fat; gain stamina; and build bone density (particularly important for women and osteoporosis). Though it does generally require weight lifting; strength training can also incorporate exercises like push-ups; squats; and crunches. Even if you're already a cardio workout guru; you're only part way to a high-impact exercise routine. Everyone needs to incorporate strength training to build lean muscle before it becomes fat.",A gym's weight room can seem like Muscle Beach to a daunted beginner. If you're inexperienced with strength training; it probably makes sense to start your new routine with help from a personal trainer; or an experienced friend or family member. To get going; check out this guide to the basics from WebMD.,10,1
7,Buy in bulk.,"When was the last time you bought one toothpick? Probably never. If someone tried to sell you one toothpick for; let's say; five cents; you would probably go ""that's ridiculous. I can get a box of 100 toothpicks for one dollar. This is marked up by 500%!"" And then you'd slap him in the face. But: little do you know; this principle applies to just about everything you buy. Not so slap-happy now; are you? ","Whether you favor big cavernous membership-card stores; or an online solution (there are tons of bulk shopping sites online); successful bulk buying depends on research. Make sure the seller is trustworthy; the price actually saves you money; and that you actually need what you're buying: don't get saddled buying the world's largest crate of cotton balls just because it was ""only"" $25; or buying products that are going to expire before you can use them anyway. Also; be sure you have storage space for your bulk items. If you plan for all of that -- value; need; perishability; storage -- you'll save money. ",5,1
8,Call your parents.,Every sitcom in the world has already made jokes about this; so we're going to take the serious approach: when you're away from your parents; it's hard for them to feel connected to you; which is no fun because they love you. Calling them is a simple way to stay close -- sometimes an annoying imposition on you when you're trying to go out and do Young People Things; yes; but important nonetheless. ,"The key thing here is not to procrastinate. Especially if your parents are the type who like to have 45-minutes discourses about things like groceries; or the characters of NCIS; or when they can finally expect some grandchildren; it's easy to say ""heck with it; I'll call them tomorrow."" But ""tomorrow"" turns into several weeks very easily; and that'll make your parents sad. Do you want to make your parents sad? ",2,1
9,Clean the bathroom.,"All of your house needs cleaning; but the bathroom is a different beast altogether. If you think about everything that goes on in your bathroom over the course of a week -- or a month; EWWWWWWW -- you'll realize quickly that keeping it clean isn't just good hygiene and good housekeeping; it's necessary to prevent the feeling of being totally skeeved out every time you walk in there. (""Skeeved out"" is a scientific term; by the way.) ",De-skeeving your bathroom can be intimidating -- I have to scrub WHAT? -- but if you make it a regular habit and start slowly; you'll have a shiny bathroom in no time. Our friend the FlyLady supports the Swish and Swipe method; a daily 2-minute habit of wiping down your counter; faucet; sink; and toilet with surface/window cleaner and paper towels; then quickly scrubbing the inside of the toilet with a brush. Boom -- you're done; and your bathroom is fresh! Of course it's a good idea to clean the floors regularly (especially if you have kids or pets who tend to track things into and out of the bathroom) and do a deeper scrub now and then; but don't let periodic cleanings take the place of daily freshness. ,5,1
10,Clean up.,No matter how much you want it to; that mess won't clean itself up. (n.b. This does not apply if you are a wizard.) ,Every mess is different; but the approach is always basically the same: isolate the mess; grit your teeth; ATTACK THE MESS; and get it done. ,2,1
11,Clean your floors and carpets.,Floors are like roads for your feet. Imagine if you were driving your car down a road covered in nails; oil slicks; and clouds of dust -- you wouldn't have a very enjoyable drive; unless perhaps you are playing Mario Kart. The same principle applies in your home: clean floors are more hygienic; safer; and much more pleasant to walk on.,Carpets want to be vacuumed; floors want to be swept and/or mopped. There are a lot of intense and complicated ways to do this (and periodically; yes; it's good to steam-clean your carpets or use industrial clear-sludge cleaning goop on your floors); but basically anything that conveys dirt from your floors onto not your floors will suffice just fine. Don't underestimate the power of even a quick sweep-up to make your kitchen or hallway feel like a totally different room. ,5,1
12,Cook a meal.,We eat too much takeout. This is just a fact -- a big part of the obesity epidemic in the world today is that there's so much greasy; fat-laden; ludicrously over-portioned restaurant food out there; calling out to us with the promise of cheap; convenient calories. You can make a big difference in your diet; and bring your family together at the same time; by cooking at home instead. ,A lot of us are intimidated by the prospect of cooking anything more complicated than mac 'n' cheese. Don't be. You don't have to be Julia Child to make a delicious dinner in your home; things like roast chicken; grilled vegetables; pasta; and other classics are often surprisingly easy. The whole Internet is here to help you with this -- find a simple; healthy recipe you like; and get started! ,3,1
13,Cook with someone else.,They say that too many cooks spoil the broth; this is true in professional kitchens and in Metaphor Land. But in our everyday lives; for those of us whose cooking skills are more attuned to Chef Boy-Ar-Dee than Julia Child; a partner cooking alongside you is an absolute godsend. Being able to share a successful meal you've made together; even if one of you was just cluelessly sauteeing vegetables while the other one made everything else (hello; married couples); is a great way to bond.,You and your cooking partner can work together on interpreting recipes; preparing ingredients; stirring; straining; seasoning; and all the tasks of cooking that tax either your brainpower or your ability to multitask. Let the more experienced chef take the lead; but share opinions freely: it's good to have a reality check before dumping; let's say; garlic salt into a meal that already basically tastes like a salt lick. (A certain DailyFeats team member may have done that recently. Don't judge.) ,5,1
14,Cross-train.,Why did Rocky have to run so much when his specialty was punching people? Well; so there was plenty of inspiring footage to accompany that fantastic Rocky music... but also because great athletes know the body needs a range of workouts to stay in peak condition. If you're only doing one kind of workout (just running; just weight-training; just yoga; etc.); you may not be as fit as you think you are. You've got to mix it up if you want to be a champion like The Italian Stallion. ,"To increase overall fitness and reduce risk of injury; you should shoot for a cross-training routine that activates different muscle groups and varies cardio styles. Check out this advice from Runner's World. Be sure to keep the Rocky theme going by blasting Survivor's ""Eye of the Tiger"" while you work out; this is essential. ",10,1
15,Cut down on junk food.,According to the classic The Berenstain Bears and Too Much Junk Food; excessive consumption of chips; cookies; candy; fast food; and soda is seriously unhealthy for cartoon bears. As you likely know; science tells us that it's just as bad for humans. Studies have firmly established that a diet high in fat and calories can lead to obesity; type 2 diabetes; and heart disease. The more researchers dig into the health effects of junk food consumption; the more issues they uncover.,Choose real food instead! You're more likely to reach for junk when you're stressed or in a rush; so plan your meals in advance and organize your kitchen; your lunchbox; and your schedule to keep healthy snack options like fruits; veggies; unsalted nuts; and low-sugar granola bars within arm's reach. You may find it difficult to make the switch at first; so decide whether a gradual or cold-turkey approach is best for you.,2,1
16,Cut down on sodium.,"Sodium (a.k.a. salt; in a food context) is an insidious little devil. It's an essential electrolyte that your body needs to survive; in small portions it makes savory foods taste rich and delicious; in large portions it can produce wonderful things like cured meats or pickled fish; and it kills you. See; despite sodium's good qualities; today's diet is so overflowing with it -- used liberally as a preservative and to add flavor into the bland; cheap; processed; frozen ""food"" we eat so much of -- that we're literally overdosing. Too much sodium leads to heart disease; especially hypertension; not to mention ulcers and other badness -- it's one of the most serious problems in our diet today; ","Because of the way most of us are used to eating; cutting down sodium is really hard. The USDA recommends consuming no more than 2;300 milligrams of sodium in a day (or 1;500 if you're over 50; African-American; or have hypertension; kidney disease; or diabetes); for perspective; a single teaspoon of table salt contains 2;315 milligrams. Yes. And there's salt in almost every processed food; even in things you wouldn't expect; like cereal and milk; frozen foods and fast foods will often contain more than your entire daily requirement of salt in a single serving.  So what can you do? First and foremost; eat less processed food (the quiet source of over 75% of most people's sodium intake); choose fresh; raw food whenever possible. Pass on processed meats like sausage; lunch meat; ham; and bacon (sorry). Skip the salt in your recipes; use spices and herbs instead. Be careful with condiments; which are often laden with salt. And if you must buy processed food; look for labeled ""low-sodium"" alternatives; although that really is just the lesser of evils. Now; some people find it hard to quit salt cold turkey; because we're so used to its taste in everything; the transition can be jarring; so work your way down slowly. Every step counts. ",3,1
17,Cut spending in 2 areas.,Trimming down to a budget is harder than it looks; and if you try to do it all at once; it can wind up being like a really non-fun version of Whack-A-Mole. So start small.,Focus on two problem areas of your budget; and think about how you could cut those expenses; maybe by 10 or 20 percent. Then do it; and stick to it for a month. Once you've got that done; move on to the next two; until your budget is balanced! ,5,1
18,Discover good new music.,Are you stuck in a musical rut? You might be. Even music lovers will sometimes find themselves listening to the same albums; over and over again. And if you're still relying on commercial radio; forget about it -- you won't hear anything that hasn't been focus-grouped to death. These days you have to take initiative to find new music that really reaches you -- yet there's so much out there; more than ever; waiting to bring you incredible aesthetic and emotional experiences. Nothing elevates your soul and heightens your senses in quite the same way as good music; so; seek it out! ,There are lots of paths to new music. Blogs are a rich source; especially if there's a niche genre you're into; explore independent and college radio; or online streaming radio. The best source may be your friends -- great music is usually begging to be shared (legally; of course). Just remember; as you explore the vast world of independent & alternative music; to keep your mind open -- don't let your prejudices hold you back. ,1,1
19,Do positive work.,Everyone has a different way to do good; many of us do it by raising families; or by volunteering in our off hours. But some of us have the opportunity to do good at your jobs. This is a special kind of contribution: making it your vocation to help others is one of the greatest gifts you can give; and it often gives back tenfold in personal satisfaction (if not always in money). People who choose these careers -- teachers; caregivers; advocates and nonprofit workers; change agents of all stripes -- deserve to be celebrated; as do people who find space in their more conventional workday to give back. ,If your job has you doing good all day; then... well; congratulations! Otherwise; see what you can do at work to give back. Does your employer sponsor a charitable project you can help out with? ,15,1
20,Do yoga.,Yoga is a unique and powerful form of exercise; which has enormous health and emotional benefits; proven over millennia of practice in several religious traditions. ,The best way to get started doing yoga is by visiting a class. There are also many videos and TV programs that will introduce you. ,3,1
21,Don't stay up late.,"Because you need your beauty sleep. And by ""beauty sleep"" you mean ""the REM sleep that is necessary for your brain to work.""",Refuse the temptation to stay up. That stupid late-night talk show isn't worth it. Hit the sack! ,3,1
22,Dress well on a budget.,There's no shame in wanting to look good. We all do! But all too often; dressing well seems to come with a scary price tag. Here's a secret: you don't have to spend money to dress well. With a bit of creativity or a dogged persistence in deal-hunting; you can make a stylish statement; and still have enough money to actually go somewhere in your new clothes. ,Used; used; used! Buying gently used clothes -- even haute couture from last season -- can save you tons of money. Vintage clothing is often equally cheap; and adds an extra sense of unique flair (don't you want to be the one showing up to work in a leopard-skin pillbox hat)? (Pro tip: leopards are an endangered species. Do not wear their skin.) ,5,1
23,Drink fair trade coffee.,Fair trade coffee is a good deal for everyone -- it ensures a respectful price and good living for the people who grow it; a healthy environment for the people who live around it; and a delicious cup of coffee for you. ,Look for the Fair Trade Certified seal on the coffee you buy; or in the coffee shop you visit. ,2,1
24,Drink green tea.,Despite all the BS claims about green tea -- it is not; in fact; a magic elixir made from unicorn tears -- it can help lower cholesterol and may reduce cancer risk. Anyway it's certainly better than the creamy; sugary; brain-frying sadness juice you drink now. ,There are many kinds of green tea; and you can get it basically anywhere. It's good hot or iced. ,2,1
25,Drink orange juice.,Have you met my imaginary friend Joe? No? That's because Joe died of scurvy; the poor imaginary sap; from not getting enough imaginary Vitamin C. Avoid Joe's tragic imaginary fate by drinking a good helping of (real) delicious orange juice! ,Whether you squeeze it from the orange with your own brute force; or enjoy it from a carton/bottle -- in which case; avoid juice from concentrate; flavored drinks; or anything that isn't 100% juice -- just drink it! One of the joys of orange juice is that you don't have to fancy it up with sugar or additives: it's refreshing all on its own. ,2,1
26,Dust your home.,Let's clear one thing up first. Dust bunnies are not cute. They aren't even bunnies. Dust is piled-up balls of dead skin; dirt; hair bits; light airborne garbage particles; plant pieces; insect poop; and anything else that floats secretly through the air. Do you want to hang out with that stuff on your desk; staring at you? ,"Whether you use a fancy-schmancy HEPA air filter system; or a more traditional ""window""-based filter system; you'll need to dust your home periodically. Use a slightly damp rag or a microfiber cloth (feather dusters mostly just kick dust back up into the air; so it can resettle immediately after you leave the room); and start with high surfaces like ceiling fans and bookshelves; moving downward. (Otherwise you'll knock dust down onto things you've just cleaned!) There are lots more nuances if you're going on a serious dusting spree -- don't forget about things like lampshades (yes; you have to clean lampshades. Did we just BLOW YOUR MIND?); for one thing. See more here. ",3,1
27,Eat a complete breakfast.,"Remember all those cereal commercials that said ""part of this complete breakfast;"" showing it next to a delicious spread of eggs and toast? They weren't just saying that because it's an awesome catchphrase. They were saying that because they wanted their cereal to look like a healthy start to the day; when in fact their cereals were mostly just Sugary Flour Blobs. An actual healthy breakfast will give you (and your kids; who are in especially great need of a nutritious breakfast and especially likely to eat junk instead -- the energy you need to take on the day; without lathering on the sugar and fat. ",The primary purpose of breakfast is pull your body out of its sleepy; fasted state and get your metabolism running -- so you don't need a ton of food; just the right food. Start with dense proteins (egg whites are an excellent choice) to get your motor running; and some complex carbs to keep you from getting hungry later in the morning (stick with whole grains; like 100% whole wheat bread; you won't get much out of the refined white flour that makes up pastries and many cereals). Throw in some of the essential vitamins and minerals you need at every meal; and try to cover three of the four food groups; without adding anything loaded up with saturated fats; cholesterol; sugar; or sodium -- meaning; cut out the sausage and bacon (try turkey sausage if you're really in that traditional-breakfast mood) and replace maple syrup with sweet; fresh fruit. You can do this! ,2,1
28,Eat a vegetarian or vegan meal.,There are lots of different reasons to skip meat -- for some people it's an ethical issue; for some an environmental one; and for some it's a path to better nutrition and weight loss. (Meats can be very fatty; brim with cholesterol; and often come drenched in sodium and oil.) We prefer to focus on the fact that vegetables and grains; too often unheralded in our cuisine; can be absolutely delicious in a way that meat just can't imitate. If you haven't tried a well-prepared vegetarian meal; you're missing out on some sublime culinary experiences. ,The primary challenge in healthy vegetarian eating is getting enough protein. Make liberal use of dairy (if it's part of your diet); tofu; beans; grains (try quinoa where you might otherwise use pasta) and nuts (watch out for their fat content; though); and pile on vegetables like peas and spinach. (Don't focus on just one protein: your body metabolizes them in varying ways; so it's important to have a variety). Beyond that; if you're used to the fatty richness of meat; its absence can be jarring; cook your vegetables creatively (we endorse roasting as a simple way to make just about any veggie delicious) and experiment freely to find recipes that satisfy your palate. ,3,1
29,Eat fruit or vegetables.,"Fruit and vegetables not only boast bright colors and amusing names like ""arugula"" and ""kumquat;"" they also contain the vitamins; minerals; and fiber that your body needs to fight disease and stay balanced. And almost nobody gets enough. The MyPlate guide actually says that half of every meal should be fruit and vegetables. Half. How do you like them apples? (...See what we did there? ""Apples""? Never mind.) ",Go eat some fruit and/or vegetables. Feel free to arrange them in an attractive or amusing way; just be sure you eat them afterwards. (Pro tip: dried or highly processed fruits are not going to be so useful to you. Focus on the fresh or frozen.) ,2,1
30,Eat healthy with the family.,Help your children develop balanced eating habits by following your example. A family that eats together; celebrating the experience of a family meal; builds positive behaviors that your kids will retain for life.,This doesn't need to be a formal !familydinner. Eating together is as simple as grabbing a delicious !completebreakfast before school; or sharing a snack in the afternoon. The key is to lead by example: if your kids see that you're trying a variety of new foods; they'll be more comfortable trying it too (especially if they can have a bit of yours first).,2,1
