id,name,why,how,bonus_points,published
31,Eat leafy greens.,"Have you ever heard of Vitamin K? The K stands for ""Kick-ass"". Vitamin K is the reserved; secretive little vitamin that regulates blood clotting; help keeps your bones firm; and may prevent diabetes; arthritis; and inflammation; plus; because it's fat-soluble; foods with Vitamin K are actually healthier if you eat them with oil or dressing. WHAT?!?! Yeah. Anyway; Vitamin K is one of dozens of such nutrients that are all up in leafy green vegetables; such as spinach; cabbage kale; arugula; Swiss chard; collard greens; mustard greens; and even the greens that stick out of vegetables like turnips and beets. These guys are loaded with fiber; beta carotene; an entire alphabet of vitamins; calcium; antioxidants; and all with a bare minimum of calories and carbs. They are the A-Team of vegetables; and they rank among the healthiest things you can ever eat. (Our primitive ancestors ate leaves basically nonstop -- some projections say they would eat an entire grocery bag's worth of leafy vegetables every day.) ",Conveniently; leafy greens don't have legs and generally aren't sentient; so you don't have to chase or wrestle them in order to subdue them. You can just pick up as many leafy vegetables as you want; out of your garden (pro tip: swiss chard) or at the grocery store - here's a good list for reference. To eat them; a salad is the obvious choice; especially if they're fresh (try a local farmer's market to get them at their peak - the difference can be astounding); it can be startling at first to adjust to the intense flavor of leafy greens if you're used to more boring vegetables like lettuce; but within a few days you'll never want to go back. You can also saut??e just about any leafy greens: drop those bad boys in a pan with some oil and garl,3,1
32,Eat lean meat.,If you want to cut down on your intake of fat and cholesterol; you should probably -- well; you should probably avoid meat entirely. But a vegetarian diet is a radical change for a lot of people; and for some it just isn't nutritionally or culturally realistic; the next best option is to choose hearty; protein-rich; lean meat. ,"I've got two words for you: ""SEA"" and ""FOOD."" Fish and seafood are lean; light; and wonderfully flavorful (if you're lucky enough to get them fresh; that is -- don't trifle with frozen or processed 'fish' products; or anything that strikes you as; uh; ""fishy."" Subprime seafoods pose a serious toxicity risk). Our landlocked; pregnant; or finicky friends might do better with poultry (favor breasts and white meats to reduce fat intake; and for heaven's sake don't eat the skin); or -- wait for it -- wild game; which is usually much leaner than farm-raised meat.      If you are indulging in red meat -- and DailyFeats won't begrudge you an occasional steak or stack of shortribs (we're all human) -- try to make leaner choices; like 90%+ lean ground beef (have you tried ground bison as a substitute) or anything labeled ""extra lean;"" and cut off or drain fat whenever possible when cooking. The American Heart Association has an excellent; throrough guide to your options. ",2,1
33,Eat leftovers.,Every time you throw food away; a little baby plant cries. So does your wallet. About 40% of all food in America is wasted; and it collectively costs us over $1 billion -- with a B -- just to dispose of it; never mind growing; shipping; processing; preserving; and cooking it in the first place. Does all that really have to happen just because you don't want reheated pasta? ,"Some foods; like pizza; make this easy. (Pro tip: reheat pizza on a nonstick griddle at very low heat; to get a crispy crust and warm; melty cheese.) Other times it's as simple as packing up a lunch in a sturdy bag or plastic container. But if you've got; for example; leftover meat stuck to a congealed roast chicken; you might be tempted to throw it away. Don't be: whether you take a shortcut to make it appetizing; such as dumping cheese and hot sauce on it; and nuking the hell out of it (in culinary circles this is known as ""the Fratboy Special""); or search for a recipe that will make use of sundry materials -- try a site like Supercook that generates recipes based on the ingredients you have handy -- a little commitment to leftovers goes a long way. ",2,1
34,Eat less fat.,Fat's not evil -- our bodies need a certain amount of it to function -- but too much of it causes problems. And the way we eat; these days; almost everybody gets too much of it. Choosing low-fat or nonfat foods can make a big difference in helping you achieve a balanced diet. ,"Don't be fooled by ""low-fat"" versions of crappy processed foods. If they have to take fat out of something; it shouldn't be something you eat in the first place; and it will probably taste like wood chips anyway. Instead; choose meals that don't have a lot of fat: emphasize lean meat (if you eat meat at all) and always remove the skin; minimize your use of oils; creams; mayonnaise; and butter; and for heaven's sake don't fry things (choose baked; boiled; broiled; and steamed foods instead). ",3,1
35,Eat less sugar.,You're sweet enough already. (Awwwww.) But listen: it's no secret that excessive consumption of sugar has been adding inches to America's waistlines and cavities to its mouths for the past several decades. As if that weren't bad enough; research also suggests that eating too much sugar might damage your heart; too. ,If you drink soda or other sugary drinks daily; you need to roundhouse kick that habit. Replace your usual beverage with water; which is not only good for you; it also doesn't slowly kill you. Make sure to read food nutrition facts to trim other unnecessary sugar. It can hide in unexpected places: did you know that some brands of jarred spaghetti sauce have as much sugar per serving as a Pop Tart? Check out this list of hidden sugar sources; and start shopping smarter. ,3,1
36,Eat locally grown food.,Unless you're a really big fan of the Asian cargo-ship industry; it's better to buy your food from local producers. Local food isn't just fresher and likely more natural -- it also supports your local economy and bolsters family farms; which badly need your help. ,Lots of supermarkets; especially food co-ops; are now highlighting local food. Better yet; find a farmers' market; farm stand; or farm share near you! ,2,1
37,Eat natural food.,They say ??you are what you eat?? -- well; when you were a kid; did you say ??When I grow up I want to be disodium guanylate and added artificial flavorings??? No; you did not. ,A lot of products claim to be ??natural;?? ??organic;?? etc. You can't always trust them. Research what you buy; and see how clear brands and restaurants are about what's in their food and where it comes from -- the more detail you can find; the more confident you can be that you're eating real food! ,2,1
38,Embrace your potential.,Because being realistic doesn't mean giving up. Too many of us assume that our lives' potentials are limited by the circumstances around us; and that the idea of chasing a dream belongs in books and children's movies; that just isn't true. If you study the world objectively you'll see that opportunity is everywhere; and that with motivation and perseverance you can accomplish things that seem utterly impossible right now. The laws of physics dictate that energy never disappears; it only changes form; if you put your energy into your dreams; even if that dream seems awfully far away; by definition that energy is going somewhere; and you are therefore on your way to achieving your goals.,"The key to this feat is resolve. Working toward your potential can be a long; trying; and discouraging experience; and if you don't start off on the right foot you're not very likely to succeed. So make a resolution -- and not a lightweight; vague one like ""I'm going to be super cool;"" but rather a concrete one that you can build plans for; like ""I'm going to learn graphic design"" or ""I'm going to run a marathon."" Once you've done that; you can start planning; and your potential will start looking very real indeed. ",10,1
39,Enjoy your relationship.,Sure; there's lots of work involved in a relationship -- whether it's your first week of dating or your fortieth year of marriage. But one of the best ways to keep each other happy and satisfied is to... well... keep each other happy and satisfied. After all; every couple should spend some time enjoying life's great pleasures; and they should feel free to get excited about it; unleashing your passion helps keep your relationship joyful and lively. ,Obviously; we're talking here about organized card tournaments; such as bridge; canasta; or pinochle competitions. Other table games; like bingo or mahjongg; are also fun ways to put some spice into your relationship. / If you're not of the card-game persuasion -- and why not; might we ask -- there are all kinds of places for you to find your passion. Whether it's in art; music; food; dancing; hiking; rock-climbing; paintball; beatboxing; antiquing; competitive bowling; Civil War reenactment... we are rambling. Point being; find something that makes you happy; and pour your heart and soul in it. /What; you thought we meant something else? Why would you think that? ,5,1
40,Express love.,Being told 'I love you' can be a marvelous; dramatic; swelling-orchestral-soundtrack moment in your life -- but it can also be a daily; constant reminder of the relationships your life is founded on. Both of these are pretty excellent things. ,This is best when it's organic -- let it slip out over dinner; when you're hanging up the phone; or just at random during a silent moment. You don't need to make a big deal out of it. ,2,1
41,Fix something yourself.,Professional service and repair is expensive. Like; first-born expensive. You can save a LOT of money just by learning to do some very basic household tasks. And it's always better to be able to take care of things around the house; instead of sitting around in a cold/flooded/drafty house waiting for your landlord or a contractor to come around. ,It's important not to bite off more than you can chew. Don't go messing around with your heating; plumbing; or electricity (for example) without some experience and expertise; you could very easily break something; or worse; hurt yourself. Instead start with little things -- a finicky toilet flush here; a squeaky door hinge there -- and work your way up. Use every resource available to you; from users' manuals and online guides (check for good sources if you go this route) to friendly neighbors and of course common sense. Take opportunities to learn when they come around: try changing your own oil one day; or help out a friend with a home renovation project. Eventually you'll be ready to handle a once-daunting maintenance challenge without blinking an eye! ,5,1
42,Get a good night's sleep.,When you don't get the rest you need; you start to look like a zombie. Nobody likes zombies; people tend to run away from them; screaming. That can sometimes hold back the unfortunate zombie-resembling people's attempts to socialize. Beyond not looking like a zombie; researchers have uncovered many benefits of healthy sleep patterns: people who get enough quality sleep at night enjoy greater memory; physical performance; creativity; and longevity. They also tend to have lower stress and body weight. And; most importantly for those of us who share our beds; they're usually not as crabby or zombie-like in the mornings. ,7-8 undisturbed hours per night is widely considered the best target for adults. To get there; connect with some counting sheep. If that doesn't work; try these tips -- for starters; say no to late afternoon caffeine fixes; and avoid using your computer or smartphone for an hour before you hit the sack. ,3,1
43,Get a health screening.,Everybody likes to get checked out by an attractive stranger from time to time--so why not get checked out by a doctor? Periodic screening for a range of common health issues is a hugely important part of preventative medicine. In short: screening helps your doctor catch small problems before they become big; scary; expensive ones. Depending on your age and gender; you may need occasional mammograms; prostrate exams; depression screenings; vision and hearing exams; STD testing; etc. Most screenings are relatively quick and painless. ,If you consistently visit a primary care physician; you're probably already being screened; but talk to your doctor to make sure that's the case. Don't forget to raise any specific concerns you may have based on your personal and family medical history. ,15,1
44,Get active with the family.,Families are stronger together -- and active playtime is one of your greatest opportunities to build that strength. By getting active together; you're teaching your kids that an active; healthy lifestyle can be fun -- not to mention building their confidence; teamwork and self-esteem. (Doesn't hurt to get yourself off the couch; either.),Just get up; and get going! This doesn't have to be long or structured: throwing a ball around; racing around the yard; even just a walk to explore nature or the neighborhood. Activity adds up over time; and the more you do it; the easier and more natural it'll get. ,10,1
45,Get sunlight safely (with sunscreen).,Sunlight provides Vitamin D; which keeps your bones from suddenly turning to mush; and it can help improve your mood. Also sunbathing is more fun than work. ,Use some decent sunscreen (at least 30 SPF); then just find a place to soak up the sun! Parks and riverbanks are nice. If you get bored easily; bring a book or music. ,1,1
46,Get your vitamins.,"Take a page out of the great lyricist Popeye's book: ""I'm strong to the finich 'cause I eats my spinach."" America's favorite sailor man used the powerful vitamins and minerals in a can of spinach to beat the bad guy and get the girl every time! So impress the Olive Oyl in your life by eating a diet rich in the nutrients your body needs. Vitamin deficiency can cause a whole host of nasty symptoms like anemia; bone weakness; and fatigue; ensuring that you get your Recommended Dietary Allowance (RDA) of essential vitamins and minerals keeps your body at its best today; and protects your future health. ","Most people can get the vitamins they need from regularly eating a diverse range of fruits; vegetables; lean proteins; and whole grains. Hey; DailyFeats; what about all those vitamin and multivitamin supplements? The Harvard School of Public Health calls vitamin supplements a ""good insurance policy"" for people concerned about their vitamin intake; but studies have suggested that your body is much better at processing vitamins found naturally in healthy foods. Don't rely on pills when real food is available. ",2,1
47,Go above and beyond at work.,"According to recent research; Americans are the most overworked people in the developed world. So extra responsibilities might seem like the last thing you need; but offering to lend a hand shows your co-workers you care. After all; you can't succeed if the team doesn't. For a little inspiration; revisit what you learned from Reading Rainbow: ""TEAM WORK. You got a dream; you want to make it real; you need a team; working up steam to make your DREAM WORK."" Yes: dream work. ",Become the invisible elf who refills the printer paper and the coffeepot. Volunteer to support co-workers with a lot on their plates. If you have the time; tackle a project to improve your work environment. ,5,1
48,Go camping.,The campfire! Long recognized as a symbol of rugged survivalism; a provider of warmth; and a melter of marshmallows; today's campfire is the centerpiece of that great American adventure we call camping. Spend some quality time with it. ,Everyone camps a little differently; depending on your experience level and where you are; for example; some confused souls camp indoors. (This is usually less satisfying.) the important thing is that you plan ahead; making sure to bring plenty of supplies and food; so that once you're there you're not uncomfortable; worried; or forced to scavenge neighboring campsites and fight bears for scraps. (Bear fights usually end; in our experience; with a delicious dinner for the bear.) ,25,1
49,Go hiking.,Hiking is exercise in its purest form: the same way our ancestors got around; tens of thousands of years ago. Except with more trail mix and jackets; and less shamanic medicine and mastodon fights. But; you know; details. ,Make sure you prepare well; and choose a trail near you that looks like it's your style. ,25,1
50,Go running.,Our bodies were built to run. You don't need to be an endurance runner or a tribal game hunter to use your natural running ability!,Lace up some running shoes and just run somewhere. The rest is pretty much up to you. ,10,1
51,Go swimming.,You can drop your body into a huge pool of water; and more or less; it floats. Doesn't that kind of blow your mind? Also; you know; exercise is good. ,Presuming you've had swimming lessons; just head for your local pool or beach.,5,1
52,Go to your college class.,Yes; we know. Your bed is comfortable. And it's cold outside. And your lecture is on the other side of campus. And you're pretty sure you can get the notes online or from your friend Steve anyway. And Maury Povich is about to come on; and you freaking love Maury Povich. And you forgot to shower; and this stuff probably isn't going to be on the exam; and you can't find your lucky pencil; etc. TOO BAD. Sack up and go to class. Skipping lectures in college is stupid; it's a waste of an opportunity and a waste of time. ,You know how to do this. You did it freshman week; before you turned into the horrible slacker you've become; and you still do it for that one 9am stats class that put the fear of God into you. So do it for the rest of them! If you're really struggling with making it to class; here is some helpful advice. ,2,1
53,Have a date night.,Whether you're in the infatuated first stages of a relationship; or going into your 50th year of domestic bliss; a relationship still needs that time -- a night; even just a couple of hours; for you and your partner to just be together; enjoying each other's company. Without it; even the most devoted couples can start to drift. ,It's hard to go wrong with a nice dinner (although they can get pricey); feel free to get more creative. Where did you and your partner meet? Is there a romantic spot on the edge of town you always wanted to go? Tonight's the night! ,5,1
54,Have a healthy snack.,Because an unhealthy snack would be; uh... unhealthy. (DailyFeats: proudly serving tautologies since 2011.) And snacking; in and of itself; is important -- eating lots of small; nutritious meals throughout the day is better for your metabolism and prevents gorging at mealtime. ,This is the challenging part. Plan your snacks around these key elements:   Calories. Unless you're an athlete or a bodybuilder; you don't need more than 200 calories in your snack; probably even 100. You just don't.      Long-term satisfaction. Emphasize foods with soluble fiber and low glycemic load; so the nutrients hit your bloodstream slowly and create a lasting feeling of fullness.    Nutrition. Your snack shouldn't be empty calories: get the protein; complex carbs; and vitamins you need to sustain yourself.      So what makes a good snack? Try fresh fruit and vegetables; whole grain breads or crackers; yogurt; or trail mix/nuts); and always keep your portion small. Here are some more suggestions!,2,1
55,Have a picnic.,Back in the day; picnics were a classic American tradition; between increasing suburbanization and our dependence on processed food; though; they've started to vanish from our emotional landscape. That's a shame; because picnics are a simple and enjoyable way to spend quality time with your family and enjoy the outdoors at the same time. Bring this old standby back! ,You'll need some people; a big blanket; napkins. food -- sandwiches are an easy choice; as are cold salads (pack with ice to prevent spoilage) or leftovers; and make sure to bring lots of fresh fruit and vegetables -- and a good spot; usually in a public park (make sure that food is permitted) or; in a pinch; your or a family member's backyard. Once you're there; sit and enjoy! Always clean up after yourself: it's rude to leave junk lying around in nature. ,15,1
56,Have dinner with your family.,It's well-documented that eating in front of the television; on the road; at your desk; or wherever else; leads to overeating. But it's also just less fun! Family dinners are a beloved tradition in a lot of families; and for good reason: they're a chance to reflect on the day; talk about what matters you to; and enjoy time together without distractions. Even if that time leads to arguments and awkwardness sometimes -- which; in many families; it inevitably will -- it's better than eating alone. ,Can you eat? Can you sit? Can you do both at once; without looking at your cellphone or a television? Good -- you're done. Everything else is irrelevant. ,5,1
57,Have fun with your family.,Is your family big? Small? Close-knit or extended? Imaginary? Doesn't matter. You can still enjoy time together; which is what family is all about.,As we all know; the best way to do this is to rent a bus or large RV; travel with your family to a large open meadow; and start an impromptu music festival featuring violin jam sessions and handmade artisanal corn dogs. But if for some reason this option is not available to you; we recommend a simpler approach: get your family together and visit the park; set up a game; or just put some children (preferably yours) in a room and see what happens. Usually; given the right conditions; fun emerges. ,3,1
58,Have grandparent-grandkid time.,Grandparents are families' secret weapons. Most of the time they lurk in the background; watching NCIS; forwarding you emails that have clip art drawings of teddy bears in them; and puttering around town at 25mph making jerks in sports cars hurl their cellphones at them in rage. But one day; out of the blue; BAM: there the grandparents are; looking after your kids; providing valuable guidance borne of wisdom and experience; and building an irreplaceable connection to your family's heritage. Didn't see that coming; did you? They're like ninjas. ,If you're lucky enough to have one or more grandparent around -- and remember; not everyone is -- call them up! Retired or not; they'd probably love to spend some time with you; no need for a special occasion or a fancy family get-together. Break out a board game; cook a meal together; go out for a walk; or just hang out -- trust us; even if their senior-citizen habits grind your gears a little; it's worth it. / Now; if you are a grandparent: isn't that Mark Harmon just great on NCIS? Also; when was the last time you called up your grandkids' house? No sense sitting by the phone waiting for them to call you -- kids these days rarely think to communicate by phone. ,5,1
59,Have hope.,No matter our circumstances; we can always have hope. It's the belief -- the resolve -- that the future will be better than the present. Living with hope energizes; motivates; and compels us to live well. It brings purpose. And if nothing else; it brings a smile and a bit of calm in a life that can be otherwise quite unpredictable. ,Many people draw hope from their faith; others from history and philosophy; others from family; friends; and the joyful moments that quietly fill our lives. No matter what inspires you to see positive change in the world; just focus on it; and use it as a reminder for you when things get difficult. ,1,1
60,Have perspective.,We get hung up on small obstacles. Everybody does it. When you're stuck in traffic; or fumbling with a screwdriver; or trying to convince your four-year-old to just eat the freaking broccoli; little things in life can make us furious. Luckily there's a simple solution to this problem: thinking about the big picture; the context of our lives and world; can make these trivial problems seem -- well -- trivial. ,For some of us it's as simple as stopping; when we're at the point of frustration; and thinking about why we're really here: family; love; faith; passion; purpose. Other times; we really benefit from an outside reality check: how would your grandparents; for example; have reacted to this situation? What about one of your role models? Seeing a situation through someone else's eyes can completely reorient our opinions about it. ,1,1
61,Hit a personal best.,Some of the greatest moments in our lives are when we're shown a barrier -- a line that it seems like we can't cross -- and one day; bam; we break through it. Hitting a personal best is one of those moments. It's awesome. And a dedicated practice regimen; in athletics or in any part of life; can get you there regularly.,A great coach once told us that when you compete with yourself; you always win. Pushing yourself; training yourself; finding hidden strengths; and striving to improve your performance bit-by-bit -- that's what makes a champion; whether you're an athlete; an artist; a businessperson; a parent; or anybody who's got a big job to tackle.,15,1
